<?xml version="1.0" encoding="UTF-8"?>
<!-- TEST L0c workflow -->
<Ipf_Task_Table xmlns:xsi="http://www.w3.org/2001/XMLSchema-instance" xsi:noNamespaceSchemaLocation="TaskTable_L0c.xsd">
    <Processor_Name>S2IPF - L0c</Processor_Name>
    <Version>01.03</Version>
    <Test>false</Test>
    <Min_Disk_Space units="MB">512</Min_Disk_Space>
    <Max_Time units="sec">36000</Max_Time>
    <Sensing_Time_Flag>true</Sensing_Time_Flag>
    <List_of_Cfg_Files count="0"/>
    <List_of_Dyn_ProcParam count="2">
        <Dyn_ProcParam>
            <Param_Name>QL_GEO_MODE</Param_Name>
            <Param_Type>String</Param_Type>
            <Param_Default>Detector</Param_Default>
        </Dyn_ProcParam>
        <Dyn_ProcParam>
            <Param_Name>NUM_ATF</Param_Name>
            <Param_Type>Number</Param_Type>
            <Param_Default>1</Param_Default>
        </Dyn_ProcParam>
        <Dyn_ProcParam>
            <Param_Name>LIST_OF_DETECTORS</Param_Name>
            <Param_Type>String</Param_Type>
            <Param_Default>01-02-03-04-05-06-07-08-09-10-11-12</Param_Default>
        </Dyn_ProcParam>
        <Dyn_ProcParam>
            <Param_Name>PARRALLEL_BAND_QL_IDENT</Param_Name>
            <Param_Type>String</Param_Type>
            <Param_Default>B01-B02-B03-B10-B11</Param_Default>
        </Dyn_ProcParam>
    </List_of_Dyn_ProcParam>
    <List_of_Pools count="5">
        <Pool>
            <Detached>false</Detached>
            <Killing_Signal>15</Killing_Signal>
            <List_of_Tasks count="2">
                <Task>
                    <Name>INIT_LOC_L0</Name>
                    <Version>01.00</Version>
                    <Critical>true</Critical>
                    <Criticality_Level>1</Criticality_Level>
                    <File_Name>$USERPROFILE/PycharmProjects/Orchestrator/tests/custom/INIT_LOC_L0.py</File_Name>
                    <List_of_Inputs count="8">
                        <Input>
                            <Mode>ALWAYS</Mode>
                            <Mandatory>Yes</Mandatory>
                            <List_of_Alternatives count="1">
                                <Alternative>
                                    <Order>1</Order>
                                    <Origin>DB</Origin>
                                    <Retrieval_Mode>ValIntersect</Retrieval_Mode>
                                    <T0>0</T0>
                                    <T1>0</T1>
                                    <File_Type>PDI_DS</File_Type>
                                    <File_Name_Type>Directory</File_Name_Type>
                                </Alternative>
                            </List_of_Alternatives>
                        </Input>
                        <Input>
                            <Mode>ALWAYS</Mode>
                            <Mandatory>Yes</Mandatory>
                            <List_of_Alternatives count="1">
                                <Alternative>
                                    <Order>1</Order>
                                    <Origin>DB</Origin>
                                    <Retrieval_Mode>ValIntersect</Retrieval_Mode>
                                    <T0>0</T0>
                                    <T1>0</T1>
                                    <File_Type>PDI_DS_GR_LIST</File_Type>
                                    <File_Name_Type>Directory</File_Name_Type>
                                </Alternative>
                            </List_of_Alternatives>
                        </Input>
                        <Input>
                            <Mode>ALWAYS</Mode>
                            <Mandatory>Yes</Mandatory>
                            <List_of_Alternatives count="1">
                                <Alternative>
                                    <Order>1</Order>
                                    <Origin>DB</Origin>
                                    <Retrieval_Mode>ValIntersect</Retrieval_Mode>
                                    <T0>0</T0>
                                    <T1>0</T1>
                                    <File_Type>GIP_DATATI</File_Type>
                                    <File_Name_Type>Physical</File_Name_Type>
                                </Alternative>
                            </List_of_Alternatives>
                        </Input>
                        <Input>
                            <Mode>ALWAYS</Mode>
                            <Mandatory>Yes</Mandatory>
                            <List_of_Alternatives count="1">
                                <Alternative>
                                    <Order>1</Order>
                                    <Origin>DB</Origin>
                                    <Retrieval_Mode>ValIntersect</Retrieval_Mode>
                                    <T0>0</T0>
                                    <T1>0</T1>
                                    <File_Type>GIP_BLINDP</File_Type>
                                    <File_Name_Type>Physical</File_Name_Type>
                                </Alternative>
                            </List_of_Alternatives>
                        </Input>
                        <Input>
                            <Mode>ALWAYS</Mode>
                            <Mandatory>Yes</Mandatory>
                            <List_of_Alternatives count="1">
                                <Alternative>
                                    <Order>1</Order>
                                    <Origin>DB</Origin>
                                    <Retrieval_Mode>ValIntersect</Retrieval_Mode>
                                    <T0>0</T0>
                                    <T1>0</T1>
                                    <File_Type>GIP_SPAMOD</File_Type>
                                    <File_Name_Type>Physical</File_Name_Type>
                                </Alternative>
                            </List_of_Alternatives>
                        </Input>
                        <Input>
                            <Mode>ALWAYS</Mode>
                            <Mandatory>Yes</Mandatory>
                            <List_of_Alternatives count="1">
                                <Alternative>
                                    <Order>1</Order>
                                    <Origin>DB</Origin>
                                    <Retrieval_Mode>ValIntersect</Retrieval_Mode>
                                    <T0>0</T0>
                                    <T1>0</T1>
                                    <File_Type>GIP_VIEDIR</File_Type>
                                    <File_Name_Type>Physical</File_Name_Type>
                                </Alternative>
                            </List_of_Alternatives>
                        </Input>
                        <Input>
                            <Mode>ALWAYS</Mode>
                            <Mandatory>Yes</Mandatory>
                            <List_of_Alternatives count="1">
                                <Alternative>
                                    <Order>1</Order>
                                    <Origin>DB</Origin>
                                    <Retrieval_Mode>ValIntersect</Retrieval_Mode>
                                    <T0>0</T0>
                                    <T1>0</T1>
                                    <File_Type>GIP_INVLOC</File_Type>
                                    <File_Name_Type>Physical</File_Name_Type>
                                </Alternative>
                            </List_of_Alternatives>
                        </Input>
                        <Input>
                            <Mode>ALWAYS</Mode>
                            <Mandatory>Yes</Mandatory>
                            <List_of_Alternatives count="1">
                                <Alternative>
                                    <Order>1</Order>
                                    <Origin>DB</Origin>
                                    <Retrieval_Mode>ValIntersect</Retrieval_Mode>
                                    <T0>0</T0>
                                    <T1>0</T1>
                                    <File_Type>DEM_GLOBEF</File_Type>
                                    <File_Name_Type>Directory</File_Name_Type>
                                </Alternative>
                            </List_of_Alternatives>
                        </Input>
                        <Input>
                            <Mode>ALWAYS</Mode>
                            <Mandatory>Yes</Mandatory>
                            <List_of_Alternatives count="1">
                                <Alternative>
                                    <Order>1</Order>
                                    <Origin>DB</Origin>
                                    <Retrieval_Mode>ValIntersect</Retrieval_Mode>
                                    <T0>0</T0>
                                    <T1>0</T1>
                                    <File_Type>AUX_UT1UTC</File_Type>
                                    <File_Name_Type>Directory</File_Name_Type>
                                </Alternative>
                            </List_of_Alternatives>
                        </Input>
                        <Input>
                            <Mode>ALWAYS</Mode>
                            <Mandatory>Yes</Mandatory>
                            <List_of_Alternatives count="1">
                                <Alternative>
                                    <Order>1</Order>
                                    <Origin>DB</Origin>
                                    <Retrieval_Mode>ValIntersect</Retrieval_Mode>
                                    <T0>0</T0>
                                    <T1>0</T1>
                                    <File_Type>ANC_DATA</File_Type>